{
  "$schema": "./dissertation-work-queue.schema.json",
  "schema_version": "ets.dissertation.queue.v1",
  "program": {
    "id": "ETS-DISSERTATION",
    "issue": 120,
    "mode": "dissertation_only",
    "other_autonomous_work_paused": true,
    "active_sprint": "D1",
    "default_branch": "main",
    "repository": "ShannonBrayNC/ETS"
  },
  "execution": {
    "cadence": "PT1H",
    "max_tasks_per_pass": 1,
    "target_minutes_per_pass": 45,
    "lease_minutes": 55,
    "allow_overlapping_passes": false,
    "selection_order": [
      "priority",
      "sprint_order",
      "task_order",
      "id"
    ],
    "completion_requires_evidence": true,
    "auto_merge_policy": "documentation_or_research_only_after_required_checks_pass_and_no_human_gate",
    "external_publication_allowed": false
  },
  "allowed_statuses": [
    "planned",
    "ready",
    "in_progress",
    "blocked",
    "human_review",
    "completed",
    "cancelled"
  ],
  "sprints": [
    {"id": "D0", "order": 0, "name": "Academic governance and publication control"},
    {"id": "D1", "order": 1, "name": "Evidence baseline and formal-status reconciliation"},
    {"id": "D2", "order": 2, "name": "Manuscript and citation infrastructure"},
    {"id": "D3", "order": 3, "name": "Literature review, related work, and novelty"},
    {"id": "D4", "order": 4, "name": "Theory, protocol, threat model, and formal verification"},
    {"id": "D5", "order": 5, "name": "Methodology, evaluation, and reproducibility"},
    {"id": "D6", "order": 6, "name": "Integrated manuscript, figures, tables, and technical edit"},
    {"id": "D7", "order": 7, "name": "Review, formatting, defense, and archival deposit"}
  ],
  "tasks": [
    {
      "id": "D0-001",
      "sprint": "D0",
      "task_order": 1,
      "priority": 0,
      "title": "Record advisor viability and thesis decision",
      "status": "blocked",
      "automation_eligible": false,
      "approval_required": true,
      "dependencies": [],
      "issue_refs": [66, 120],
      "requirement_refs": ["D0-R1", "D0-R4"],
      "outputs": ["docs/dissertation/ADVISOR_DECISION_RECORD.md"],
      "acceptance_criteria": ["Advisor identity or role, date, decision, thesis wording, and required revisions are recorded."],
      "validation": ["Human advisor confirmation"],
      "claim_risk": "approval_gate",
      "completion_evidence": []
    },
    {
      "id": "D0-002",
      "sprint": "D0",
      "task_order": 2,
      "priority": 0,
      "title": "Record doctoral restart, committee, and administrative path",
      "status": "blocked",
      "automation_eligible": false,
      "approval_required": true,
      "dependencies": [],
      "issue_refs": [66, 120],
      "requirement_refs": ["D0-R2", "D0-R3"],
      "outputs": ["docs/dissertation/ACADEMIC_PROGRAM_GATE.md"],
      "acceptance_criteria": ["Current institutional requirements and the user's approved path are recorded without inferring approval."],
      "validation": ["Advisor, department, and Graduate Education confirmation"],
      "claim_risk": "approval_gate",
      "completion_evidence": []
    },
    {
      "id": "D0-003",
      "sprint": "D0",
      "task_order": 3,
      "priority": 0,
      "title": "Record IP, authorship, ethics, and disclosure decisions",
      "status": "blocked",
      "automation_eligible": false,
      "approval_required": true,
      "dependencies": [],
      "issue_refs": [120],
      "requirement_refs": ["D0-R5"],
      "outputs": ["docs/dissertation/PUBLICATION_CONTROL_REGISTER.md"],
      "acceptance_criteria": ["Authorized decisions cover authorship, AI assistance, IP, patent timing, ethics, copyright, license, embargo, and public disclosure."],
      "validation": ["Human academic and IP review"],
      "claim_risk": "approval_gate",
      "completion_evidence": []
    },
    {
      "id": "D1-001",
      "sprint": "D1",
      "task_order": 1,
      "priority": 0,
      "title": "Freeze dissertation evidence candidate baseline",
      "status": "ready",
      "automation_eligible": true,
      "approval_required": false,
      "dependencies": [],
      "issue_refs": [67, 120],
      "requirement_refs": ["D1-R1"],
      "outputs": ["docs/research/dissertation-evidence-baseline.json", "docs/research/DISSERTATION_EVIDENCE_BASELINE.md"],
      "acceptance_criteria": ["Exact commit, branch, workflow context, runtime/tool inventory, and evidence scope are recorded.", "Unknown values are marked unknown rather than guessed."],
      "validation": ["python scripts/dissertation_queue.py validate", "Manual SHA and source-link review"],
      "claim_risk": "high",
      "completion_evidence": []
    },
    {
      "id": "D1-002",
      "sprint": "D1",
      "task_order": 2,
      "priority": 0,
      "title": "Reconcile conflicting formal and CI status records",
      "status": "planned",
      "automation_eligible": true,
      "approval_required": false,
      "dependencies": ["D1-001"],
      "issue_refs": [67, 70, 120],
      "requirement_refs": ["D1-R2"],
      "outputs": ["docs/research/FORMAL_EVIDENCE_LEDGER.md"],
      "acceptance_criteria": ["Every TLC, Apalache, Lean, test, lint, type, benchmark, and replay claim has one authoritative status tied to evidence.", "Contradictory historical statements are identified for correction."],
      "validation": ["Cross-check retained run URLs, logs, SHAs, and manifests"],
      "claim_risk": "critical",
      "completion_evidence": []
    },
    {
      "id": "D1-003",
      "sprint": "D1",
      "task_order": 3,
      "priority": 0,
      "title": "Capture full TLC evidence or bounded blocker record",
      "status": "planned",
      "automation_eligible": true,
      "approval_required": false,
      "dependencies": ["D1-002"],
      "issue_refs": [70, 120],
      "requirement_refs": ["D1-R3"],
      "outputs": ["artifacts/tlc/manifest.json", "docs/research/FULL_TLC_EVIDENCE.md"],
      "acceptance_criteria": ["Every configured model has pass, fail, timeout, or blocked status with bounds and durable evidence.", "A bounded or timed-out run is not described as a universal proof."],
      "validation": ["Run the full TLC evidence workflow or record an exact environment/resource blocker"],
      "claim_risk": "critical",
      "completion_evidence": []
    },
    {
      "id": "D1-004",
      "sprint": "D1",
      "task_order": 4,
      "priority": 0,
      "title": "Resolve Lean and Apalache evidence status",
      "status": "planned",
      "automation_eligible": true,
      "approval_required": false,
      "dependencies": ["D1-002"],
      "issue_refs": [67, 120],
      "requirement_refs": ["D1-R4"],
      "outputs": ["docs/research/LEAN_APALACHE_EVIDENCE.md"],
      "acceptance_criteria": ["Failures are repaired and rerun or retained as failed/pending with claim impact.", "Proof categories are not conflated."],
      "validation": ["Lean and Apalache workflow logs and retained artifact review"],
      "claim_risk": "critical",
      "completion_evidence": []
    },
    {
      "id": "D1-005",
      "sprint": "D1",
      "task_order": 5,
      "priority": 1,
      "title": "Create durable dissertation evidence index",
      "status": "planned",
      "automation_eligible": true,
      "approval_required": false,
      "dependencies": ["D1-003", "D1-004"],
      "issue_refs": [67, 74, 120],
      "requirement_refs": ["D1-R5"],
      "outputs": ["artifacts/dissertation/ARTIFACT_INDEX.json", "artifacts/dissertation/README.md"],
      "acceptance_criteria": ["Index contains checksums, producers, SHAs, versions, dates, status, retention location, and limitations."],
      "validation": ["Checksum and path validation"],
      "claim_risk": "high",
      "completion_evidence": []
    },
    {
      "id": "D1-006",
      "sprint": "D1",
      "task_order": 6,
      "priority": 1,
      "title": "Refresh claim traceability against authoritative evidence",
      "status": "planned",
      "automation_eligible": true,
      "approval_required": false,
      "dependencies": ["D1-005"],
      "issue_refs": [67, 73, 120],
      "requirement_refs": ["D1-R6"],
      "outputs": ["docs/research/claim-traceability-manifest.json", "docs/research/FORMAL_TRACEABILITY_MATRIX.md"],
      "acceptance_criteria": ["Every publication claim maps to current evidence or is pending/not claimed.", "No expired or failed artifact is represented as passing."],
      "validation": ["pytest tests/research tests/unit/test_dissertation_gate_artifacts.py"],
      "claim_risk": "critical",
      "completion_evidence": []
    },
    {
      "id": "D1-007",
      "sprint": "D1",
      "task_order": 7,
      "priority": 1,
      "title": "Disposition dissertation-relevant pull requests and stale branches",
      "status": "planned",
      "automation_eligible": true,
      "approval_required": false,
      "dependencies": ["D1-006"],
      "issue_refs": [92, 120],
      "requirement_refs": ["D1-R7"],
      "outputs": ["docs/dissertation/DISSERTATION_CHANGESET_REGISTER.md"],
      "acceptance_criteria": ["Every open dissertation-relevant PR and divergent artifact is classified as integrate, supersede, close, rebase, or defer with rationale.", "No unpublished branch is silently treated as part of the evidence baseline."],
      "validation": ["Open PR, issue, branch, and default-branch comparison review"],
      "claim_risk": "high",
      "completion_evidence": []
    },
    {
      "id": "D2-001",
      "sprint": "D2",
      "task_order": 1,
      "priority": 1,
      "title": "Create buildable master manuscript and chapter sources",
      "status": "planned",
      "automation_eligible": true,
      "approval_required": false,
      "dependencies": ["D1-007"],
      "issue_refs": [120],
      "requirement_refs": ["D2-R1", "D2-R2"],
      "outputs": ["docs/dissertation/manuscript/README.md", "docs/dissertation/manuscript/chapters/"],